scenario,mean_pm25,median_pm25,p95_pm25,exc_who24h_pct,exc_whoann_pct,delta_vs_baseline,pct_change
Baseline (No Policy),42.97522,40.801567,58.772076,100.0,100.0,0.0,0.0
Scenario A 30% Industry Cut,42.550472,40.4149,56.694706,100.0,100.0,-0.42474747,-0.9883543
Scenario B Early Monsoon,47.73413,42.152504,67.45176,100.0,100.0,4.758911,11.073617
Scenario C Traffic Restriction,42.980484,40.779568,58.628323,100.0,100.0,0.005264282,0.012249577
Scenario D Green Belt +20%,42.977375,40.77285,58.7003,100.0,100.0,0.002155304,0.0050152247
Scenario E All Policies Combined,46.254898,41.393993,64.84342,100.0,100.0,3.2796783,7.6315565
